{
  "id": "example_episodic",
  "type": "episodic",
  "created": "2024-01-15T09:00:00",
  "source": "manual",
  "summary": "I learned that building a recursive memory system requires layered storage.",
  "raw_ref": "example_raw",
  "importance": 0.75,
  "tags": ["learning", "concept", "project"],
  "links": ["[[raw/example_raw]]"]
}
